student,title,supervisor,co_supervisor,assessor1,assessor2,mentor1,mentor2,mentor3,mentor4
Rochkoulets Maxime,Interactions between Kolmogorov Arnold networks and tensor decompositions,Hendrik Blockeel,Wannes Meert,,"",,,,
Senica Dailen,Tricking AI: comparison of adversarial examples,Hendrik Blockeel,,,"",,,,
Sirbu Traian-Florin,Semi-supervised classification of IoT failure Data,Stefano Viazzi,"",,"",,,,
Demuynck Dieter,Tricking AI: comparison of adversarial examples,Stefano Viazzi,,,"",,,,
Geybels Maarten,Decomposing KAN networks: A tensor decomposition analysis of Kolmogorov-Arnold neural networks,Mariya Ishteva,"",,"",,,,
Hamelink Frederic,Time series motif discovery: the faster the better,Mariya Ishteva,Wannes Meert,,"",,,,
